<!ELEMENT jugadores (jugador+)>

<!ELEMENT jugador (nombre,consola,puntos)>

<!ELEMENT nombre (#PCDATA)>
<!ELEMENT consola (#PCDATA)>
<!ELEMENT puntos (#PCDATA)>
